{
  "record_id": "irf:example:irf-06",
  "record_type": "IRF-06",
  "schema_version": "IRF/1.0",
  "created_at": "2026-08-06T00:00:00Z",
  "effective_at": null,
  "expires_at": null,
  "status": "proposed",
  "normative_force": "advisory",
  "authority_effect": "advisory",
  "action_class": "C",
  "source_framework_id": "IRF/1.0",
  "source_framework_version": "1.0",
  "source_record_ids": [],
  "supersedes": [],
  "superseded_by": [],
  "actor_id": "institutional-regeneration-steward",
  "actor_type": "public_body",
  "office_or_role": "Regeneration review secretariat",
  "representation_source": null,
  "technical_credential_refs": [],
  "constituting_instrument": null,
  "legal_power": null,
  "jurisdiction_territorial": null,
  "jurisdiction_personal": null,
  "jurisdiction_subject_matter": "institutional regeneration",
  "jurisdiction_temporal": null,
  "affected_party_refs": [
    "workers",
    "beneficiaries"
  ],
  "affected_indigenous_nation_refs": [],
  "protected_domain_flags": [],
  "consent_record_refs": [],
  "authority_record_refs": [],
  "activation_record_refs": [],
  "access_class": "DECISION_BODY",
  "public_summary": "Proposal for a purpose, mandate, causal-responsibility, and objective-reproduction audit.",
  "protected_annex_refs": [],
  "data_purpose": "Demonstrate IRF v1.0 schema conformance.",
  "retention_rule": "Retain through review and closure.",
  "correction_status": "none",
  "challenge_status": "none",
  "review_due_at": "2026-09-06T00:00:00Z",
  "closure_state": "open",
  "unresolved_duty_refs": [],
  "handoff_state": "not_applicable",
  "recipient_refs": [],
  "recipient_acceptance_refs": [],
  "hashes_and_signatures": [],
  "human_accountable_officer": "Chief institutional steward",
  "prohibited_inferences": [
    "record completion proves regeneration",
    "advisory analysis creates authority"
  ],
  "consequence_profile": "CP2",
  "adoption_state": "advisory_use",
  "reform_classes": [
    "reproductive"
  ],
  "evidence_access_status": [
    "available"
  ],
  "authority_formation": "retained",
  "response_duty_effect": "charter_internal",
  "response_duty_source": null,
  "acknowledgment_clock_source": null,
  "decision_clock_source": null,
  "response_time_assessment_ref": null,
  "provisional_safe_state_record_ref": null,
  "post_acceptance_action_clock_ref": null,
  "pilot_type": "not_applicable",
  "minimum_causal_adequacy_status": "not_applicable",
  "irf_payload": {
    "institution_ref": "example-institution",
    "programme_ref": null,
    "stated_mandate": "Deliver equitable regional health coordination.",
    "revealed_purpose": "Preserve programme continuity and reporting compliance.",
    "causal_controller_refs": [
      "regional-budget-board",
      "appointment-committee"
    ],
    "selection_pressure_refs": [
      "annual-renewal-funding",
      "promotion-by-throughput",
      "political-blame-avoidance"
    ],
    "common_mode_dependency_refs": [
      "shared-consultancy-network",
      "single-analytics-vendor"
    ],
    "impossible_mandate_status": "not_present",
    "adoption_integrity_statement_ref": "irf:integrity:001",
    "ordinary_owner_ref": null,
    "support_withdrawal_plan_ref": null,
    "successor_ref": null,
    "unresolved_duty_custody_refs": [],
    "framework_falsification_ref": null,
    "conclusions_not_supported": [
      "legitimacy",
      "causal efficacy",
      "permission to restructure or close"
    ]
  }
}
