{
  "record_id": "irf:example:irf-49",
  "record_type": "IRF-49",
  "schema_version": "IRF/1.0",
  "created_at": "2026-08-06T00:00:00Z",
  "effective_at": null,
  "expires_at": null,
  "status": "authorized",
  "normative_force": "procedural",
  "authority_effect": "authority_reference",
  "action_class": "K",
  "source_framework_id": "IRF/1.0",
  "source_framework_version": "1.0",
  "source_record_ids": [],
  "supersedes": [],
  "superseded_by": [],
  "actor_id": "institutional-regeneration-steward",
  "actor_type": "public_body",
  "office_or_role": "Regeneration review secretariat",
  "representation_source": null,
  "technical_credential_refs": [],
  "constituting_instrument": "Regional Council Resolution 2026:44",
  "legal_power": "Transfer programme custody and continuing duties.",
  "jurisdiction_territorial": null,
  "jurisdiction_personal": null,
  "jurisdiction_subject_matter": "institutional regeneration",
  "jurisdiction_temporal": null,
  "affected_party_refs": [
    "workers",
    "beneficiaries"
  ],
  "affected_indigenous_nation_refs": [],
  "protected_domain_flags": [],
  "consent_record_refs": [],
  "authority_record_refs": [
    "authority:regional-council:2026-44"
  ],
  "activation_record_refs": [],
  "access_class": "DECISION_BODY",
  "public_summary": "Successor-custody and reproductive-risk record for a lawfully authorized programme transition.",
  "protected_annex_refs": [],
  "data_purpose": "Demonstrate IRF v1.0 schema conformance.",
  "retention_rule": "Retain through review and closure.",
  "correction_status": "none",
  "challenge_status": "none",
  "review_due_at": "2026-09-06T00:00:00Z",
  "closure_state": "closing",
  "unresolved_duty_refs": [
    "claim:employment:004",
    "case:beneficiary:119"
  ],
  "handoff_state": "not_applicable",
  "recipient_refs": [],
  "recipient_acceptance_refs": [],
  "hashes_and_signatures": [],
  "human_accountable_officer": "Chief institutional steward",
  "prohibited_inferences": [
    "record completion proves regeneration",
    "advisory analysis creates authority"
  ],
  "consequence_profile": "CP2",
  "adoption_state": "transition_authorized",
  "reform_classes": [],
  "evidence_access_status": [
    "available"
  ],
  "authority_formation": "transferred",
  "response_duty_effect": "legal",
  "response_duty_source": null,
  "acknowledgment_clock_source": null,
  "decision_clock_source": null,
  "response_time_assessment_ref": null,
  "provisional_safe_state_record_ref": null,
  "post_acceptance_action_clock_ref": null,
  "pilot_type": "not_applicable",
  "minimum_causal_adequacy_status": "not_applicable",
  "irf_payload": {
    "institution_ref": "example-institution",
    "programme_ref": null,
    "stated_mandate": null,
    "revealed_purpose": null,
    "causal_controller_refs": [],
    "selection_pressure_refs": [
      "same-appointment-chain",
      "same-data-vendor"
    ],
    "common_mode_dependency_refs": [],
    "impossible_mandate_status": "not_assessed",
    "adoption_integrity_statement_ref": "irf:integrity:001",
    "ordinary_owner_ref": "regional-public-health-office",
    "support_withdrawal_plan_ref": "irf:support-withdrawal:001",
    "successor_ref": "regional-public-health-office",
    "unresolved_duty_custody_refs": [
      "labour-tribunal",
      "beneficiary-appeals-office"
    ],
    "framework_falsification_ref": "gmeaia:framework-review:irf-001",
    "conclusions_not_supported": [
      "transition proves regeneration",
      "successor will not reproduce predecessor failures"
    ]
  }
}
