{
  "record_id": "irf:example:irf-38",
  "record_type": "IRF-38",
  "schema_version": "IRF/1.0",
  "created_at": "2026-08-06T00:00:00Z",
  "effective_at": null,
  "expires_at": null,
  "status": "unresolved",
  "normative_force": "advisory",
  "authority_effect": "advisory",
  "action_class": "I",
  "source_framework_id": "IRF/1.0",
  "source_framework_version": "1.0",
  "source_record_ids": [],
  "supersedes": [],
  "superseded_by": [],
  "actor_id": "institutional-regeneration-steward",
  "actor_type": "public_body",
  "office_or_role": "Regeneration review secretariat",
  "representation_source": null,
  "technical_credential_refs": [],
  "constituting_instrument": null,
  "legal_power": null,
  "jurisdiction_territorial": null,
  "jurisdiction_personal": null,
  "jurisdiction_subject_matter": "institutional regeneration",
  "jurisdiction_temporal": null,
  "affected_party_refs": [
    "workers",
    "beneficiaries"
  ],
  "affected_indigenous_nation_refs": [],
  "protected_domain_flags": [],
  "consent_record_refs": [],
  "authority_record_refs": [],
  "activation_record_refs": [],
  "access_class": "DECISION_BODY",
  "public_summary": "Audit finding accepted in principle, but the competent authority lacks staff and budget to act.",
  "protected_annex_refs": [],
  "data_purpose": "Demonstrate IRF v1.0 schema conformance.",
  "retention_rule": "Retain through review and closure.",
  "correction_status": "none",
  "challenge_status": "none",
  "review_due_at": "2026-09-06T00:00:00Z",
  "closure_state": "open",
  "unresolved_duty_refs": [],
  "handoff_state": "capacity_limited",
  "recipient_refs": [
    "regional-budget-board"
  ],
  "recipient_acceptance_refs": [
    "response:budget-board:001"
  ],
  "hashes_and_signatures": [],
  "human_accountable_officer": "Chief institutional steward",
  "prohibited_inferences": [
    "record completion proves regeneration",
    "advisory analysis creates authority"
  ],
  "consequence_profile": "CP2",
  "adoption_state": "advisory_use",
  "reform_classes": [],
  "evidence_access_status": [
    "available"
  ],
  "authority_formation": "retained",
  "response_duty_effect": "legal",
  "response_duty_source": "Regional Health Act §14",
  "acknowledgment_clock_source": "GMEAIA-07 response-time assessment",
  "decision_clock_source": "Regional Health Act §14",
  "response_time_assessment_ref": "gmeaia:response-time:health-001",
  "provisional_safe_state_record_ref": null,
  "post_acceptance_action_clock_ref": "gmeaia:action-clock:health-001",
  "pilot_type": "not_applicable",
  "minimum_causal_adequacy_status": "not_applicable",
  "irf_payload": {
    "institution_ref": "example-institution",
    "programme_ref": null,
    "stated_mandate": null,
    "revealed_purpose": null,
    "causal_controller_refs": [
      "regional-budget-board"
    ],
    "selection_pressure_refs": [],
    "common_mode_dependency_refs": [],
    "impossible_mandate_status": "capacity_limited",
    "adoption_integrity_statement_ref": "irf:integrity:001",
    "ordinary_owner_ref": null,
    "support_withdrawal_plan_ref": null,
    "successor_ref": null,
    "unresolved_duty_custody_refs": [],
    "framework_falsification_ref": null,
    "conclusions_not_supported": [
      "constitutional gap",
      "automatic authority transfer",
      "proof of deliberate obstruction"
    ]
  }
}
